{
  "$schema": "https://json-schema.org/draft/2020-12/schema",
  "$id": "https://kujolang.ai/contracts/publishing-house/workflow-completion-receipt.v1",
  "title": "publishing-house.workflow-completion-receipt/v1",
  "type": "object",
  "required": [
    "contract",
    "schema_name",
    "schema_version",
    "workflow_id",
    "workflow_version",
    "run_id",
    "correlation_id",
    "created_at",
    "actor",
    "permission_mode",
    "outcome",
    "summary_reference",
    "receipt_references",
    "external_effect_declared",
    "external_effect_occurred",
    "idempotency_key",
    "provenance"
  ],
  "properties": {
    "contract": {
      "const": "publishing-house.workflow-completion-receipt/v1"
    },
    "schema_name": {
      "const": "publishing-house.workflow-completion-receipt"
    },
    "schema_version": {
      "const": "1.0.0"
    },
    "workflow_id": {
      "type": "string"
    },
    "workflow_version": {
      "type": "string"
    },
    "run_id": {
      "type": "string"
    },
    "correlation_id": {
      "type": "string"
    },
    "created_at": {
      "type": "string"
    },
    "actor": {
      "type": "string"
    },
    "permission_mode": {
      "type": "string"
    },
    "outcome": {
      "enum": [
        "completed",
        "paused",
        "blocked",
        "rejected",
        "failed"
      ]
    },
    "summary_reference": {
      "type": "object"
    },
    "receipt_references": {
      "type": "array"
    },
    "external_effect_declared": {
      "type": "boolean"
    },
    "external_effect_occurred": {
      "type": "boolean"
    },
    "idempotency_key": {
      "type": "string"
    },
    "provenance": {
      "type": "array"
    }
  },
  "additionalProperties": true
}
